{
  "id": "forest",
  "name": "Whispering Forest",
  "map": {
    "width": 20,
    "height": 18,
    "tileset": "forest",
    "music": "MUSIC_FOREST",
    "map_id": "MAP_FOREST"
  },
  "default_walkable": "forest.forest_plain_floor_1",
  "layers": {
    "terrain": [
      {
        "x": 1,
        "y": 1,
        "width": 1,
        "height": 1,
        "tile": "forest.forest_top_left_corner_wall"
      },
      {
        "x": 2,
        "y": 1,
        "width": 16,
        "height": 1,
        "tile": "forest.forest_top_wall_1"
      },
      {
        "x": 18,
        "y": 1,
        "width": 1,
        "height": 1,
        "tile": "forest.forest_top_right_corner_wall"
      },
      {
        "x": 1,
        "y": 2,
        "width": 1,
        "height": 14,
        "tile": "forest.forest_left_wall_1"
      },
      {
        "x": 18,
        "y": 2,
        "width": 1,
        "height": 14,
        "tile": "forest.forest_right_wall_1"
      },
      {
        "x": 1,
        "y": 16,
        "width": 1,
        "height": 1,
        "tile": "forest.forest_bottom_left_corner_wall"
      },
      {
        "x": 2,
        "y": 16,
        "width": 16,
        "height": 1,
        "tile": "forest.forest_bottom_wall_1"
      },
      {
        "x": 18,
        "y": 16,
        "width": 1,
        "height": 1,
        "tile": "forest.forest_bottom_right_corner_wall"
      },
      {
        "x": 3,
        "y": 3,
        "width": 1,
        "height": 1,
        "tile": "forest.forest_top_left_treetop"
      },
      {
        "x": 4,
        "y": 3,
        "width": 1,
        "height": 1,
        "tile": "forest.forest_top_right_tree_top"
      },
      {
        "x": 3,
        "y": 4,
        "width": 1,
        "height": 1,
        "tile": "forest.forest_bottom_left_treetrunk"
      },
      {
        "x": 4,
        "y": 4,
        "width": 1,
        "height": 1,
        "tile": "forest.forest_bottom_right_tree_trunk"
      },
      {
        "x": 15,
        "y": 3,
        "width": 1,
        "height": 1,
        "tile": "forest.forest_top_left_treetop"
      },
      {
        "x": 16,
        "y": 3,
        "width": 1,
        "height": 1,
        "tile": "forest.forest_top_right_tree_top"
      },
      {
        "x": 15,
        "y": 4,
        "width": 1,
        "height": 1,
        "tile": "forest.forest_bottom_left_treetrunk"
      },
      {
        "x": 16,
        "y": 4,
        "width": 1,
        "height": 1,
        "tile": "forest.forest_bottom_right_tree_trunk"
      },
      {
        "x": 6,
        "y": 7,
        "width": 1,
        "height": 1,
        "tile": "forest.forest_top_left_treetop"
      },
      {
        "x": 7,
        "y": 7,
        "width": 1,
        "height": 1,
        "tile": "forest.forest_top_right_tree_top"
      },
      {
        "x": 6,
        "y": 8,
        "width": 1,
        "height": 1,
        "tile": "forest.forest_bottom_left_treetrunk"
      },
      {
        "x": 7,
        "y": 8,
        "width": 1,
        "height": 1,
        "tile": "forest.forest_bottom_right_tree_trunk"
      },
      {
        "x": 15,
        "y": 8,
        "width": 1,
        "height": 1,
        "tile": "forest.forest_top_left_treetop"
      },
      {
        "x": 16,
        "y": 8,
        "width": 1,
        "height": 1,
        "tile": "forest.forest_top_right_tree_top"
      },
      {
        "x": 15,
        "y": 9,
        "width": 1,
        "height": 1,
        "tile": "forest.forest_bottom_left_treetrunk"
      },
      {
        "x": 16,
        "y": 9,
        "width": 1,
        "height": 1,
        "tile": "forest.forest_bottom_right_tree_trunk"
      },
      {
        "x": 3,
        "y": 12,
        "width": 1,
        "height": 1,
        "tile": "forest.forest_top_left_treetop"
      },
      {
        "x": 4,
        "y": 12,
        "width": 1,
        "height": 1,
        "tile": "forest.forest_top_right_tree_top"
      },
      {
        "x": 3,
        "y": 13,
        "width": 1,
        "height": 1,
        "tile": "forest.forest_bottom_left_treetrunk"
      },
      {
        "x": 4,
        "y": 13,
        "width": 1,
        "height": 1,
        "tile": "forest.forest_bottom_right_tree_trunk"
      },
      {
        "x": 15,
        "y": 13,
        "width": 1,
        "height": 1,
        "tile": "forest.forest_top_left_treetop"
      },
      {
        "x": 16,
        "y": 13,
        "width": 1,
        "height": 1,
        "tile": "forest.forest_top_right_tree_top"
      },
      {
        "x": 15,
        "y": 14,
        "width": 1,
        "height": 1,
        "tile": "forest.forest_bottom_left_treetrunk"
      },
      {
        "x": 16,
        "y": 14,
        "width": 1,
        "height": 1,
        "tile": "forest.forest_bottom_right_tree_trunk"
      },
      {
        "x": 10,
        "y": 4,
        "width": 1,
        "height": 1,
        "tile": "forest.forest_top_left_tree_stump"
      },
      {
        "x": 11,
        "y": 4,
        "width": 1,
        "height": 1,
        "tile": "forest.forest_top_right_tree_stump"
      },
      {
        "x": 10,
        "y": 5,
        "width": 1,
        "height": 1,
        "tile": "forest.forest_bottom_left_tree_stump"
      },
      {
        "x": 11,
        "y": 5,
        "width": 1,
        "height": 1,
        "tile": "forest.forest_bottom_right_tree_stump"
      },
      {
        "x": 5,
        "y": 14,
        "width": 1,
        "height": 1,
        "tile": "forest.forest_top_left_tree_stump"
      },
      {
        "x": 6,
        "y": 14,
        "width": 1,
        "height": 1,
        "tile": "forest.forest_top_right_tree_stump"
      },
      {
        "x": 5,
        "y": 15,
        "width": 1,
        "height": 1,
        "tile": "forest.forest_bottom_left_tree_stump"
      },
      {
        "x": 6,
        "y": 15,
        "width": 1,
        "height": 1,
        "tile": "forest.forest_bottom_right_tree_stump"
      }
    ]
  },
  "player": {
    "spawn": {
      "x": 12,
      "y": 10,
      "facing": "UP",
      "animation_frames": [
        "actors.actors_hero_frame_1",
        "actors.actors_hero_frame_2"
      ]
    }
  },
  "exits": [
    {
      "x": 12,
      "y": 11,
      "target_scene": "field",
      "target_x": 12,
      "target_y": 1,
      "direction": "SOUTH",
      "tile_char": "<"
    },
    {
      "x": 9,
      "y": 14,
      "target_scene": "forestbis",
      "target_x": 12,
      "target_y": 4,
      "direction": "SOUTH",
      "tile_char": ">"
    }
  ],
  "objects": [
    {
      "id": "forest_slime",
      "type": "enemy",
      "overworld_sprite": "actors.actors_slime_frame_1",
      "animation_frames": [
        "actors.actors_slime_frame_1",
        "actors.actors_slime_frame_2"
      ],
      "position": {
        "x": 10,
        "y": 8
      },
      "properties": {
        "entity_id": "ENTITY_ID_SLIME",
        "display_name": "SLIME",
        "actor_id": 2,
        "facing": "DOWN",
        "flags": [
          "HOSTILE",
          "BLOCKING",
          "INTERACTABLE"
        ],
        "visual": "E",
        "hp": 12,
        "max_hp": 12,
        "gold_reward": 5,
        "reward_currency": "CURRENCY_ID_GOLD",
        "battle": "BATTLE_SLIME",
        "ai": "AI_PATROL_CROSS"
      }
    },
    {
      "id": "forest_bat",
      "type": "enemy",
      "overworld_sprite": "forest.forest_enemy_bats_frame_1",
      "animation_frames": [
        "forest.forest_enemy_bats_frame_1",
        "forest.forest_enemy_bats_frame_2"
      ],
      "position": {
        "x": 7,
        "y": 4
      },
      "properties": {
        "entity_id": "ENTITY_ID_BAT",
        "display_name": "BAT",
        "actor_id": 3,
        "facing": "DOWN",
        "flags": [
          "HOSTILE",
          "BLOCKING",
          "INTERACTABLE"
        ],
        "visual": "V",
        "hp": 8,
        "max_hp": 8,
        "gold_reward": 8,
        "reward_currency": "CURRENCY_ID_GOLD",
        "battle": "BATTLE_BAT",
        "ai": "AI_PATROL_CIRCLE"
      }
    },
    {
      "id": "forest_kobold",
      "type": "enemy",
      "position": {
        "x": 4,
        "y": 10
      },
      "properties": {
        "entity_id": "ENTITY_ID_KOBOLD",
        "enemy_type": "kobold",
        "display_name": "KOBOLD",
        "actor_id": 9,
        "facing": "DOWN",
        "flags": [
          "HOSTILE",
          "BLOCKING",
          "INTERACTABLE"
        ],
        "visual": "K",
        "hp": 12,
        "max_hp": 12,
        "gold_reward": 8,
        "reward_currency": "CURRENCY_ID_GOLD",
        "battle": "BATTLE_KOBOLD",
        "ai": "AI_CHASE"
      }
    },
    {
      "id": "amulet_pickup",
      "type": "item",
      "overworld_sprite": "forest.forest_treasure_chest_forest",
      "animation_frames": [
        "forest.forest_treasure_chest_forest"
      ],
      "position": {
        "x": 16,
        "y": 10
      },
      "properties": {
        "entity_id": "ENTITY_ID_AMULET",
        "display_name": "AMULET",
        "dialogue": "DIALOGUE_ID_AMULET_NOTHING",
        "actor_id": 0,
        "facing": "DOWN",
        "flags": [
          "BLOCKING",
          "INTERACTABLE"
        ],
        "visual": "A",
        "hp": 0,
        "max_hp": 0,
        "gold_reward": 0,
        "ai": "AI_NONE"
      }
    }
  ],
  "regions": [
    {
      "id": "north_clearing",
      "bounds": {
        "x": 3,
        "y": 2,
        "width": 14,
        "height": 6
      },
      "description": "A quiet clearing where the trees thin out and ancient stumps remain.",
      "gameplay": {
        "purpose": "exploration",
        "difficulty": 1
      }
    }
  ]
}
