{
  "id": "castle_entry",
  "name": "Castle Gatehouse",
  "map": {
    "width": 20,
    "height": 18,
    "tileset": "castle",
    "music": "MUSIC_DUNGEON",
    "map_id": "MAP_CASTLE_ENTRY"
  },
  "default_walkable": "castle.castle_plain_floor",
  "layers": {
    "terrain": [
      {
        "x": 3,
        "y": 3,
        "width": 1,
        "height": 5,
        "tile": "castle.castle_left_wall"
      },
      {
        "x": 16,
        "y": 3,
        "width": 1,
        "height": 5,
        "tile": "castle.castle_right_wall"
      },
      {
        "x": 4,
        "y": 3,
        "width": 3,
        "height": 1,
        "tile": "castle.castle_top_wall"
      },
      {
        "x": 13,
        "y": 3,
        "width": 3,
        "height": 1,
        "tile": "castle.castle_top_wall"
      },
      {
        "x": 4,
        "y": 7,
        "width": 3,
        "height": 1,
        "tile": "castle.castle_bottom_wall"
      },
      {
        "x": 13,
        "y": 7,
        "width": 3,
        "height": 1,
        "tile": "castle.castle_bottom_wall"
      }
    ]
  },
  "player": {
    "spawn": {
      "x": 10,
      "y": 16,
      "facing": "UP",
      "animation_frames": [
        "actors.actors_hero_frame_1",
        "actors.actors_hero_frame_2"
      ]
    }
  },
  "exits": [
    {
      "x": 10,
      "y": 17,
      "target_scene": "mountain_pass",
      "target_x": 12,
      "target_y": 1,
      "direction": "SOUTH",
      "tile_char": "<"
    },
    {
      "x": 10,
      "y": 0,
      "target_scene": "castle_hall",
      "target_x": 10,
      "target_y": 15,
      "direction": "NORTH",
      "tile_char": ">"
    }
  ],
  "objects": [
    {
      "id": "entry_bat",
      "type": "enemy",
      "position": {
        "x": 7,
        "y": 10
      },
      "properties": {
        "entity_id": "ENTITY_ID_BAT",
        "display_name": "BAT",
        "actor_id": 33,
        "facing": "DOWN",
        "flags": [
          "HOSTILE",
          "BLOCKING",
          "INTERACTABLE"
        ],
        "visual": "V",
        "hp": 10,
        "max_hp": 10,
        "gold_reward": 8,
        "reward_currency": "CURRENCY_ID_GOLD",
        "battle": "BATTLE_BAT",
        "ai": "AI_PATROL_CIRCLE"
      },
      "overworld_sprite": "actors.actors_bats_frame_1",
      "animation_frames": [
        "actors.actors_bats_frame_1",
        "actors.actors_bats_frame_2"
      ]
    },
    {
      "id": "entry_spider",
      "type": "enemy",
      "position": {
        "x": 13,
        "y": 10
      },
      "properties": {
        "entity_id": "ENTITY_ID_SPIDER",
        "display_name": "SPIDER",
        "actor_id": 34,
        "facing": "DOWN",
        "flags": [
          "HOSTILE",
          "BLOCKING",
          "INTERACTABLE"
        ],
        "visual": "S",
        "hp": 18,
        "max_hp": 18,
        "gold_reward": 15,
        "reward_currency": "CURRENCY_ID_GOLD",
        "battle": "BATTLE_SPIDER",
        "ai": "AI_PATROL_VERT",
        "enemy_type": "spider"
      }
    }
  ],
  "regions": [
    {
      "id": "gatehouse",
      "bounds": {
        "x": 2,
        "y": 2,
        "width": 16,
        "height": 14
      },
      "description": "The ruined gatehouse of Castle Giausar.",
      "gameplay": {
        "purpose": "combat_exploration",
        "difficulty": 3
      }
    }
  ]
}
