{
  "id": "forest_grove",
  "name": "Sunken Grove",
  "map": {
    "width": 20,
    "height": 18,
    "tileset": "forest",
    "music": "MUSIC_FOREST",
    "map_id": "MAP_FOREST_GROVE"
  },
  "default_walkable": "forest.forest_plain_floor_1",
  "layers": {
    "terrain": [
      {
        "x": 4,
        "y": 3,
        "width": 1,
        "height": 1,
        "tile": "forest.forest_top_left_treetop"
      },
      {
        "x": 5,
        "y": 3,
        "width": 1,
        "height": 1,
        "tile": "forest.forest_top_right_tree_top"
      },
      {
        "x": 4,
        "y": 4,
        "width": 1,
        "height": 1,
        "tile": "forest.forest_bottom_left_treetrunk"
      },
      {
        "x": 5,
        "y": 4,
        "width": 1,
        "height": 1,
        "tile": "forest.forest_bottom_right_tree_trunk"
      },
      {
        "x": 15,
        "y": 3,
        "width": 1,
        "height": 1,
        "tile": "forest.forest_top_left_treetop"
      },
      {
        "x": 16,
        "y": 3,
        "width": 1,
        "height": 1,
        "tile": "forest.forest_top_right_tree_top"
      },
      {
        "x": 15,
        "y": 4,
        "width": 1,
        "height": 1,
        "tile": "forest.forest_bottom_left_treetrunk"
      },
      {
        "x": 16,
        "y": 4,
        "width": 1,
        "height": 1,
        "tile": "forest.forest_bottom_right_tree_trunk"
      },
      {
        "x": 4,
        "y": 13,
        "width": 1,
        "height": 1,
        "tile": "forest.forest_top_left_treetop"
      },
      {
        "x": 5,
        "y": 13,
        "width": 1,
        "height": 1,
        "tile": "forest.forest_top_right_tree_top"
      },
      {
        "x": 4,
        "y": 14,
        "width": 1,
        "height": 1,
        "tile": "forest.forest_bottom_left_treetrunk"
      },
      {
        "x": 5,
        "y": 14,
        "width": 1,
        "height": 1,
        "tile": "forest.forest_bottom_right_tree_trunk"
      },
      {
        "x": 15,
        "y": 13,
        "width": 1,
        "height": 1,
        "tile": "forest.forest_top_left_treetop"
      },
      {
        "x": 16,
        "y": 13,
        "width": 1,
        "height": 1,
        "tile": "forest.forest_top_right_tree_top"
      },
      {
        "x": 15,
        "y": 14,
        "width": 1,
        "height": 1,
        "tile": "forest.forest_bottom_left_treetrunk"
      },
      {
        "x": 16,
        "y": 14,
        "width": 1,
        "height": 1,
        "tile": "forest.forest_bottom_right_tree_trunk"
      },
      {
        "x": 5,
        "y": 7,
        "width": 1,
        "height": 1,
        "tile": "forest.forest_top_left_treetop"
      },
      {
        "x": 6,
        "y": 7,
        "width": 1,
        "height": 1,
        "tile": "forest.forest_top_right_tree_top"
      },
      {
        "x": 5,
        "y": 8,
        "width": 1,
        "height": 1,
        "tile": "forest.forest_bottom_left_treetrunk"
      },
      {
        "x": 6,
        "y": 8,
        "width": 1,
        "height": 1,
        "tile": "forest.forest_bottom_right_tree_trunk"
      }
    ]
  },
  "player": {
    "spawn": {
      "x": 9,
      "y": 15,
      "facing": "UP",
      "animation_frames": [
        "actors.actors_hero_frame_1",
        "actors.actors_hero_frame_2"
      ]
    }
  },
  "exits": [
    {
      "x": 9,
      "y": 17,
      "target_scene": "forest_deep",
      "target_x": 9,
      "target_y": 1,
      "direction": "SOUTH",
      "tile_char": "<"
    }
  ],
  "objects": [
    {
      "id": "grove_mimic",
      "type": "enemy",
      "position": {
        "x": 10,
        "y": 7
      },
      "properties": {
        "entity_id": "ENTITY_ID_MIMIC",
        "display_name": "MIMIC",
        "actor_id": 26,
        "facing": "DOWN",
        "flags": [
          "HOSTILE",
          "BLOCKING",
          "INTERACTABLE"
        ],
        "visual": "T",
        "hp": 30,
        "max_hp": 30,
        "gold_reward": 0,
        "reward_currency": "CURRENCY_ID_GOLD",
        "battle": "BATTLE_MIMIC",
        "ai": "AI_NONE",
        "enemy_type": "mimic",
        "solo": true
      },
      "overworld_sprite": "actors.actors_chest_closed",
      "animation_frames": [
        "actors.actors_chest_closed",
        "actors.actors_chest_mimic"
      ]
    },
    {
      "id": "grove_spider",
      "type": "enemy",
      "position": {
        "x": 5,
        "y": 5
      },
      "properties": {
        "entity_id": "ENTITY_ID_SPIDER",
        "display_name": "SPIDER",
        "actor_id": 27,
        "facing": "DOWN",
        "flags": [
          "HOSTILE",
          "BLOCKING",
          "INTERACTABLE"
        ],
        "visual": "S",
        "hp": 16,
        "max_hp": 16,
        "gold_reward": 15,
        "reward_currency": "CURRENCY_ID_GOLD",
        "battle": "BATTLE_SPIDER",
        "ai": "AI_PATROL_VERT",
        "enemy_type": "spider"
      }
    }
  ],
  "regions": [
    {
      "id": "sunken_grove",
      "bounds": {
        "x": 2,
        "y": 2,
        "width": 16,
        "height": 14
      },
      "description": "A treasure chest sits at the grove's heart...",
      "gameplay": {
        "purpose": "miniboss",
        "difficulty": 3
      }
    }
  ]
}
