{
  "id": "forest_deep",
  "name": "Deep Woods",
  "map": {
    "width": 20,
    "height": 18,
    "tileset": "forest",
    "music": "MUSIC_FOREST",
    "map_id": "MAP_FOREST_DEEP"
  },
  "default_walkable": "forest.forest_plain_floor_1",
  "layers": {
    "terrain": [
      {
        "x": 4,
        "y": 3,
        "width": 1,
        "height": 1,
        "tile": "forest.forest_top_left_treetop"
      },
      {
        "x": 5,
        "y": 3,
        "width": 1,
        "height": 1,
        "tile": "forest.forest_top_right_tree_top"
      },
      {
        "x": 4,
        "y": 4,
        "width": 1,
        "height": 1,
        "tile": "forest.forest_bottom_left_treetrunk"
      },
      {
        "x": 5,
        "y": 4,
        "width": 1,
        "height": 1,
        "tile": "forest.forest_bottom_right_tree_trunk"
      },
      {
        "x": 15,
        "y": 3,
        "width": 1,
        "height": 1,
        "tile": "forest.forest_top_left_treetop"
      },
      {
        "x": 16,
        "y": 3,
        "width": 1,
        "height": 1,
        "tile": "forest.forest_top_right_tree_top"
      },
      {
        "x": 15,
        "y": 4,
        "width": 1,
        "height": 1,
        "tile": "forest.forest_bottom_left_treetrunk"
      },
      {
        "x": 16,
        "y": 4,
        "width": 1,
        "height": 1,
        "tile": "forest.forest_bottom_right_tree_trunk"
      },
      {
        "x": 4,
        "y": 14,
        "width": 1,
        "height": 1,
        "tile": "forest.forest_top_left_treetop"
      },
      {
        "x": 5,
        "y": 14,
        "width": 1,
        "height": 1,
        "tile": "forest.forest_top_right_tree_top"
      },
      {
        "x": 4,
        "y": 15,
        "width": 1,
        "height": 1,
        "tile": "forest.forest_bottom_left_treetrunk"
      },
      {
        "x": 5,
        "y": 15,
        "width": 1,
        "height": 1,
        "tile": "forest.forest_bottom_right_tree_trunk"
      },
      {
        "x": 15,
        "y": 14,
        "width": 1,
        "height": 1,
        "tile": "forest.forest_top_left_treetop"
      },
      {
        "x": 16,
        "y": 14,
        "width": 1,
        "height": 1,
        "tile": "forest.forest_top_right_tree_top"
      },
      {
        "x": 15,
        "y": 15,
        "width": 1,
        "height": 1,
        "tile": "forest.forest_bottom_left_treetrunk"
      },
      {
        "x": 16,
        "y": 15,
        "width": 1,
        "height": 1,
        "tile": "forest.forest_bottom_right_tree_trunk"
      },
      {
        "x": 7,
        "y": 6,
        "width": 1,
        "height": 1,
        "tile": "forest.forest_top_left_treetop"
      },
      {
        "x": 8,
        "y": 6,
        "width": 1,
        "height": 1,
        "tile": "forest.forest_top_right_tree_top"
      },
      {
        "x": 7,
        "y": 7,
        "width": 1,
        "height": 1,
        "tile": "forest.forest_bottom_left_treetrunk"
      },
      {
        "x": 8,
        "y": 7,
        "width": 1,
        "height": 1,
        "tile": "forest.forest_bottom_right_tree_trunk"
      },
      {
        "x": 12,
        "y": 12,
        "width": 1,
        "height": 1,
        "tile": "forest.forest_top_left_treetop"
      },
      {
        "x": 13,
        "y": 12,
        "width": 1,
        "height": 1,
        "tile": "forest.forest_top_right_tree_top"
      },
      {
        "x": 12,
        "y": 13,
        "width": 1,
        "height": 1,
        "tile": "forest.forest_bottom_left_treetrunk"
      },
      {
        "x": 13,
        "y": 13,
        "width": 1,
        "height": 1,
        "tile": "forest.forest_bottom_right_tree_trunk"
      },
      {
        "x": 10,
        "y": 4,
        "width": 1,
        "height": 1,
        "tile": "forest.forest_top_left_tree_stump"
      },
      {
        "x": 11,
        "y": 4,
        "width": 1,
        "height": 1,
        "tile": "forest.forest_top_right_tree_stump"
      },
      {
        "x": 10,
        "y": 5,
        "width": 1,
        "height": 1,
        "tile": "forest.forest_bottom_left_tree_stump"
      },
      {
        "x": 11,
        "y": 5,
        "width": 1,
        "height": 1,
        "tile": "forest.forest_bottom_right_tree_stump"
      }
    ]
  },
  "player": {
    "spawn": {
      "x": 2,
      "y": 9,
      "facing": "RIGHT",
      "animation_frames": [
        "actors.actors_hero_frame_1",
        "actors.actors_hero_frame_2"
      ]
    }
  },
  "exits": [
    {
      "x": 0,
      "y": 9,
      "target_scene": "forest_glade",
      "target_x": 17,
      "target_y": 9,
      "direction": "WEST",
      "tile_char": "<"
    },
    {
      "x": 19,
      "y": 9,
      "target_scene": "forest_shrine",
      "target_x": 2,
      "target_y": 9,
      "direction": "EAST",
      "tile_char": ">"
    },
    {
      "x": 9,
      "y": 0,
      "target_scene": "forest_grove",
      "target_x": 9,
      "target_y": 15,
      "direction": "NORTH",
      "tile_char": ">"
    }
  ],
  "objects": [
    {
      "id": "deep_kobold",
      "type": "enemy",
      "position": {
        "x": 5,
        "y": 5
      },
      "properties": {
        "entity_id": "ENTITY_ID_KOBOLD",
        "display_name": "KOBOLD",
        "actor_id": 22,
        "facing": "DOWN",
        "flags": [
          "HOSTILE",
          "BLOCKING",
          "INTERACTABLE"
        ],
        "visual": "K",
        "hp": 14,
        "max_hp": 14,
        "gold_reward": 8,
        "reward_currency": "CURRENCY_ID_GOLD",
        "battle": "BATTLE_KOBOLD",
        "ai": "AI_CHASE",
        "enemy_type": "kobold"
      }
    },
    {
      "id": "deep_spider",
      "type": "enemy",
      "position": {
        "x": 14,
        "y": 5
      },
      "properties": {
        "entity_id": "ENTITY_ID_SPIDER",
        "display_name": "SPIDER",
        "actor_id": 23,
        "facing": "DOWN",
        "flags": [
          "HOSTILE",
          "BLOCKING",
          "INTERACTABLE"
        ],
        "visual": "S",
        "hp": 16,
        "max_hp": 16,
        "gold_reward": 15,
        "reward_currency": "CURRENCY_ID_GOLD",
        "battle": "BATTLE_SPIDER",
        "ai": "AI_PATROL_VERT",
        "enemy_type": "spider"
      }
    },
    {
      "id": "deep_slime",
      "type": "enemy",
      "position": {
        "x": 7,
        "y": 13
      },
      "properties": {
        "entity_id": "ENTITY_ID_SLIME",
        "display_name": "SLIME",
        "actor_id": 24,
        "facing": "DOWN",
        "flags": [
          "HOSTILE",
          "BLOCKING",
          "INTERACTABLE"
        ],
        "visual": "E",
        "hp": 20,
        "max_hp": 20,
        "gold_reward": 10,
        "reward_currency": "CURRENCY_ID_GOLD",
        "battle": "BATTLE_SLIME",
        "ai": "AI_PATROL_CROSS"
      },
      "overworld_sprite": "actors.actors_slime_frame_1",
      "animation_frames": [
        "actors.actors_slime_frame_1",
        "actors.actors_slime_frame_2"
      ]
    },
    {
      "id": "deep_bat",
      "type": "enemy",
      "position": {
        "x": 15,
        "y": 13
      },
      "properties": {
        "entity_id": "ENTITY_ID_BAT",
        "display_name": "BAT",
        "actor_id": 25,
        "facing": "DOWN",
        "flags": [
          "HOSTILE",
          "BLOCKING",
          "INTERACTABLE"
        ],
        "visual": "V",
        "hp": 8,
        "max_hp": 8,
        "gold_reward": 8,
        "reward_currency": "CURRENCY_ID_GOLD",
        "battle": "BATTLE_BAT",
        "ai": "AI_PATROL_CIRCLE"
      },
      "overworld_sprite": "actors.actors_bats_frame_1",
      "animation_frames": [
        "actors.actors_bats_frame_1",
        "actors.actors_bats_frame_2"
      ]
    },
    {
      "id": "deep_sign",
      "type": "signpost",
      "position": {
        "x": 12,
        "y": 15
      },
      "properties": {
        "entity_id": "ENTITY_ID_SIGNPOST",
        "display_name": "SIGNPOST",
        "dialogue": "DIALOGUE_ID_SIGNPOST",
        "actor_id": 0,
        "facing": "DOWN",
        "flags": [
          "BLOCKING",
          "INTERACTABLE"
        ],
        "visual": "?",
        "hp": 0,
        "max_hp": 0,
        "gold_reward": 0,
        "ai": "AI_NONE"
      }
    }
  ],
  "regions": [
    {
      "id": "deep_woods",
      "bounds": {
        "x": 2,
        "y": 2,
        "width": 16,
        "height": 14
      },
      "description": "The woods close in; the path forks north and east.",
      "gameplay": {
        "purpose": "combat_exploration",
        "difficulty": 2
      }
    }
  ]
}
