{
  "id": "castle_hall",
  "name": "Great Hall",
  "map": {
    "width": 20,
    "height": 18,
    "tileset": "castle",
    "music": "MUSIC_DUNGEON",
    "map_id": "MAP_CASTLE_HALL"
  },
  "default_walkable": "castle.castle_plain_floor",
  "layers": {
    "terrain": [
      {
        "x": 3,
        "y": 4,
        "width": 1,
        "height": 8,
        "tile": "castle.castle_left_wall"
      },
      {
        "x": 16,
        "y": 4,
        "width": 1,
        "height": 8,
        "tile": "castle.castle_right_wall"
      },
      {
        "x": 5,
        "y": 4,
        "width": 2,
        "height": 1,
        "tile": "castle.castle_top_wall"
      },
      {
        "x": 13,
        "y": 4,
        "width": 2,
        "height": 1,
        "tile": "castle.castle_top_wall"
      },
      {
        "x": 9,
        "y": 6,
        "width": 1,
        "height": 1,
        "tile": "castle.castle_table"
      },
      {
        "x": 10,
        "y": 6,
        "width": 1,
        "height": 1,
        "tile": "castle.castle_chest"
      }
    ]
  },
  "player": {
    "spawn": {
      "x": 10,
      "y": 16,
      "facing": "UP",
      "animation_frames": [
        "actors.actors_hero_frame_1",
        "actors.actors_hero_frame_2"
      ]
    }
  },
  "exits": [
    {
      "x": 10,
      "y": 17,
      "target_scene": "castle_entry",
      "target_x": 10,
      "target_y": 2,
      "direction": "SOUTH",
      "tile_char": "<"
    },
    {
      "x": 10,
      "y": 0,
      "target_scene": "castle",
      "target_x": 10,
      "target_y": 15,
      "direction": "NORTH",
      "tile_char": ">"
    }
  ],
  "objects": [
    {
      "id": "hall_kobold",
      "type": "enemy",
      "position": {
        "x": 5,
        "y": 9
      },
      "properties": {
        "entity_id": "ENTITY_ID_KOBOLD",
        "display_name": "KOBOLD",
        "actor_id": 35,
        "facing": "DOWN",
        "flags": [
          "HOSTILE",
          "BLOCKING",
          "INTERACTABLE"
        ],
        "visual": "K",
        "hp": 18,
        "max_hp": 18,
        "gold_reward": 8,
        "reward_currency": "CURRENCY_ID_GOLD",
        "battle": "BATTLE_KOBOLD",
        "ai": "AI_CHASE",
        "enemy_type": "kobold"
      }
    },
    {
      "id": "hall_spider",
      "type": "enemy",
      "position": {
        "x": 14,
        "y": 9
      },
      "properties": {
        "entity_id": "ENTITY_ID_SPIDER",
        "display_name": "SPIDER",
        "actor_id": 36,
        "facing": "DOWN",
        "flags": [
          "HOSTILE",
          "BLOCKING",
          "INTERACTABLE"
        ],
        "visual": "S",
        "hp": 18,
        "max_hp": 18,
        "gold_reward": 15,
        "reward_currency": "CURRENCY_ID_GOLD",
        "battle": "BATTLE_SPIDER",
        "ai": "AI_PATROL_VERT",
        "enemy_type": "spider"
      }
    },
    {
      "id": "hall_bat",
      "type": "enemy",
      "position": {
        "x": 15,
        "y": 13
      },
      "properties": {
        "entity_id": "ENTITY_ID_BAT",
        "display_name": "BAT",
        "actor_id": 37,
        "facing": "DOWN",
        "flags": [
          "HOSTILE",
          "BLOCKING",
          "INTERACTABLE"
        ],
        "visual": "V",
        "hp": 12,
        "max_hp": 12,
        "gold_reward": 8,
        "reward_currency": "CURRENCY_ID_GOLD",
        "battle": "BATTLE_BAT",
        "ai": "AI_PATROL_CIRCLE"
      },
      "overworld_sprite": "actors.actors_bats_frame_1",
      "animation_frames": [
        "actors.actors_bats_frame_1",
        "actors.actors_bats_frame_2"
      ]
    },
    {
      "id": "hall_knight",
      "type": "signpost",
      "position": {
        "x": 6,
        "y": 13
      },
      "properties": {
        "entity_id": "ENTITY_ID_SIGNPOST",
        "display_name": "KNIGHT",
        "dialogue": "DIALOGUE_ID_ADVICE_KNIGHT",
        "actor_id": 0,
        "facing": "DOWN",
        "flags": [
          "BLOCKING",
          "INTERACTABLE"
        ],
        "visual": "?",
        "hp": 0,
        "max_hp": 0,
        "gold_reward": 0,
        "ai": "AI_NONE"
      }
    }
  ],
  "regions": [
    {
      "id": "great_hall",
      "bounds": {
        "x": 2,
        "y": 2,
        "width": 16,
        "height": 14
      },
      "description": "A long hall of broken banners and old stone.",
      "gameplay": {
        "purpose": "combat_exploration",
        "difficulty": 3
      }
    }
  ]
}
